[
  {
    "url": "https://alpha-omega.dev/",
    "archived_url": "http://web.archive.org/web/20260704114532/https://alpha-omega.dev/",
    "archived_at": "20260704114532",
    "status": "archived",
    "retrieved": "2026-07-06",
    "method": "automated-ingestion"
  },
  {
    "url": "https://chaoss.community/",
    "archived_url": "http://web.archive.org/web/20260702212739/https://chaoss.community/",
    "archived_at": "20260702212739",
    "status": "archived",
    "retrieved": "2026-07-06",
    "method": "automated-ingestion"
  },
  {
    "url": "https://decidim.org/",
    "archived_url": "http://web.archive.org/web/20260702095059/https://decidim.org/",
    "archived_at": "20260702095059",
    "status": "archived",
    "retrieved": "2026-07-06",
    "method": "automated-ingestion"
  },
  {
    "url": "https://digitalpublicgoods.net/",
    "archived_url": "http://web.archive.org/web/20260702212957/https://www.digitalpublicgoods.net/",
    "archived_at": "20260702212957",
    "status": "archived",
    "retrieved": "2026-07-06",
    "method": "automated-ingestion"
  },
  {
    "url": "https://digitalpublicgoods.net/standard/",
    "archived_url": "http://web.archive.org/web/20260702191918/https://www.digitalpublicgoods.net/standard",
    "archived_at": "20260702191918",
    "status": "archived",
    "retrieved": "2026-07-06",
    "method": "automated-ingestion"
  },
  {
    "url": "https://element.io/",
    "archived_url": "http://web.archive.org/web/20260711222856/https://element.io/",
    "archived_at": "20260711222856",
    "status": "archived",
    "retrieved": "2026-07-13",
    "method": "automated-ingestion"
  },
  {
    "url": "https://forms.office.com/Pages/ResponsePage.aspx?id=v4j5cvGGr0GRqy180BHbRzyYkZ_d_cBMhq6xn2Bdf3tURVVYM1I3VkxXNzdMNk42M0pPRTVZODBYQy4u#",
    "archived_url": "",
    "archived_at": "",
    "status": "submitted",
    "retrieved": "2026-08-24",
    "method": "automated-ingestion"
  },
  {
    "url": "https://foundation.mozilla.org/",
    "archived_url": "http://web.archive.org/web/20180717064541/https://foundation.mozilla.org/",
    "archived_at": "20180717064541",
    "status": "archived",
    "retrieved": "2026-08-24",
    "method": "automated-ingestion"
  },
  {
    "url": "https://govstack.global/",
    "archived_url": "http://web.archive.org/web/20260629112303/https://govstack.global/",
    "archived_at": "20260629112303",
    "status": "archived",
    "retrieved": "2026-07-06",
    "method": "automated-ingestion"
  },
  {
    "url": "https://hackmd.io/@dpga/Sk05Nc21Me",
    "archived_url": "",
    "archived_at": "",
    "status": "submitted",
    "retrieved": "2026-08-24",
    "method": "automated-ingestion"
  },
  {
    "url": "https://hackmd.io/@dpga/Sk05Nc21Me#Community-Day-%E2%80%94-Friday%2C-26-June",
    "archived_url": "",
    "archived_at": "",
    "status": "submitted",
    "retrieved": "2026-08-24",
    "method": "automated-ingestion"
  },
  {
    "url": "https://hackmd.io/@dpga/Sk05Nc21Me#Community-Led-Side-Events-%E2%80%94-Friday%2C-26-June",
    "archived_url": "",
    "archived_at": "",
    "status": "submitted",
    "retrieved": "2026-08-24",
    "method": "automated-ingestion"
  },
  {
    "url": "https://hackmd.io/@dpga/Sk05Nc21Me#DPI-Day-%E2%80%94-Wednesday%2C-24-June",
    "archived_url": "",
    "archived_at": "",
    "status": "submitted",
    "retrieved": "2026-08-24",
    "method": "automated-ingestion"
  },
  {
    "url": "https://hackmd.io/@dpga/Sk05Nc21Me#OSPO-Day-%E2%80%94-Thursday%2C-25-June",
    "archived_url": "",
    "archived_at": "",
    "status": "submitted",
    "retrieved": "2026-08-24",
    "method": "automated-ingestion"
  },
  {
    "url": "https://hackmd.io/@dpga/Sk05Nc21Me#OSPOs-for-Good-%E2%80%94-Thursday%2C-25-June",
    "archived_url": "",
    "archived_at": "",
    "status": "submitted",
    "retrieved": "2026-08-24",
    "method": "automated-ingestion"
  },
  {
    "url": "https://hackmd.io/@dpga/Sk05Nc21Me#Open-Source-x-AI-%E2%80%94-Tuesday%2C-23-June",
    "archived_url": "",
    "archived_at": "",
    "status": "submitted",
    "retrieved": "2026-08-24",
    "method": "automated-ingestion"
  },
  {
    "url": "https://hackmd.io/@dpga/Sk05Nc21Me#UN-Tech-Over-%E2%80%94-Monday%2C-22-June",
    "archived_url": "",
    "archived_at": "",
    "status": "submitted",
    "retrieved": "2026-08-24",
    "method": "automated-ingestion"
  },
  {
    "url": "https://innersourcecommons.org/",
    "archived_url": "http://web.archive.org/web/20260630204112/https://innersourcecommons.org/",
    "archived_at": "20260630204112",
    "status": "archived",
    "retrieved": "2026-07-06",
    "method": "automated-ingestion"
  },
  {
    "url": "https://joinmastodon.org/",
    "archived_url": "http://web.archive.org/web/20260710052954/https://joinmastodon.org/",
    "archived_at": "20260710052954",
    "status": "archived",
    "retrieved": "2026-07-13",
    "method": "automated-ingestion"
  },
  {
    "url": "https://matrix.org/",
    "archived_url": "http://web.archive.org/web/20260704115355/https://matrix.org/",
    "archived_at": "20260704115355",
    "status": "archived",
    "retrieved": "2026-07-06",
    "method": "automated-ingestion"
  },
  {
    "url": "https://mojaloop.io/",
    "archived_url": "http://web.archive.org/web/20260610000621/https://mojaloop.io/",
    "archived_at": "20260610000621",
    "status": "archived",
    "retrieved": "2026-07-06",
    "method": "automated-ingestion"
  },
  {
    "url": "https://oict.un.org/",
    "archived_url": "",
    "archived_at": "",
    "status": "submitted",
    "retrieved": "2026-08-24",
    "method": "automated-ingestion"
  },
  {
    "url": "https://openforumeurope.org/",
    "archived_url": "http://web.archive.org/web/20260702191016/https://openforumeurope.org/",
    "archived_at": "20260702191016",
    "status": "archived",
    "retrieved": "2026-07-06",
    "method": "automated-ingestion"
  },
  {
    "url": "https://opensource.org/",
    "archived_url": "http://web.archive.org/web/20260703061548/https://opensource.org/",
    "archived_at": "20260703061548",
    "status": "archived",
    "retrieved": "2026-07-06",
    "method": "automated-ingestion"
  },
  {
    "url": "https://opensource.org/ai",
    "archived_url": "http://web.archive.org/web/20260711032902/https://opensource.org/ai",
    "archived_at": "20260711032902",
    "status": "archived",
    "retrieved": "2026-07-13",
    "method": "automated-ingestion"
  },
  {
    "url": "https://register.evolvedigital.com/events/evolvedigitalsummits/2260883",
    "archived_url": "",
    "archived_at": "",
    "status": "submitted",
    "retrieved": "2026-08-24",
    "method": "automated-ingestion"
  },
  {
    "url": "https://sdgs.un.org/goals",
    "archived_url": "http://web.archive.org/web/20260711034723/https://sdgs.un.org/goals",
    "archived_at": "20260711034723",
    "status": "archived",
    "retrieved": "2026-07-13",
    "method": "automated-ingestion"
  },
  {
    "url": "https://webtv.un.org/en/asset/k10/k10wm2b8nu",
    "archived_url": "http://web.archive.org/web/20260625155248/https://webtv.un.org/en/asset/k10/k10wm2b8nu",
    "archived_at": "20260625155248",
    "status": "archived",
    "retrieved": "2026-07-06",
    "method": "automated-ingestion"
  },
  {
    "url": "https://webtv.un.org/en/asset/k12/k12620x8tm",
    "archived_url": "http://web.archive.org/web/20260702191019/https://webtv.un.org/en/asset/k12/k12620x8tm",
    "archived_at": "20260702191019",
    "status": "archived",
    "retrieved": "2026-07-13",
    "method": "automated-ingestion"
  },
  {
    "url": "https://webtv.un.org/en/asset/k13/k136ks9z9x",
    "archived_url": "http://web.archive.org/web/20260702191019/https://webtv.un.org/en/asset/k13/k136ks9z9x",
    "archived_at": "20260702191019",
    "status": "archived",
    "retrieved": "2026-07-06",
    "method": "automated-ingestion"
  },
  {
    "url": "https://webtv.un.org/en/asset/k14/k14ej1ucqu",
    "archived_url": "http://web.archive.org/web/20260702191019/https://webtv.un.org/en/asset/k14/k14ej1ucqu",
    "archived_at": "20260702191019",
    "status": "archived",
    "retrieved": "2026-07-06",
    "method": "automated-ingestion"
  },
  {
    "url": "https://webtv.un.org/en/asset/k15/k1517v486n",
    "archived_url": "http://web.archive.org/web/20260218222324/https://webtv.un.org/en/asset/k15/k1517v486n",
    "archived_at": "20260218222324",
    "status": "archived",
    "retrieved": "2026-08-24",
    "method": "automated-ingestion"
  },
  {
    "url": "https://webtv.un.org/en/asset/k1b/k1b443e64t",
    "archived_url": "http://web.archive.org/web/20260702191019/https://webtv.un.org/en/asset/k1b/k1b443e64t",
    "archived_at": "20260702191019",
    "status": "archived",
    "retrieved": "2026-07-06",
    "method": "automated-ingestion"
  },
  {
    "url": "https://webtv.un.org/en/asset/k1c/k1cqj3jcdx",
    "archived_url": "http://web.archive.org/web/20260702191019/https://webtv.un.org/en/asset/k1c/k1cqj3jcdx",
    "archived_at": "20260702191019",
    "status": "archived",
    "retrieved": "2026-07-06",
    "method": "automated-ingestion"
  },
  {
    "url": "https://webtv.un.org/en/asset/k1i/k1i4m11zkv",
    "archived_url": "http://web.archive.org/web/20260628181825/https://webtv.un.org/en/asset/k1i/k1i4m11zkv",
    "archived_at": "20260628181825",
    "status": "archived",
    "retrieved": "2026-07-06",
    "method": "automated-ingestion"
  },
  {
    "url": "https://webtv.un.org/en/asset/k1i/k1i8jasxz4",
    "archived_url": "http://web.archive.org/web/20260514161712/https://webtv.un.org/en/asset/k1i/k1i8jasxz4",
    "archived_at": "20260514161712",
    "status": "archived",
    "retrieved": "2026-08-24",
    "method": "automated-ingestion"
  },
  {
    "url": "https://webtv.un.org/en/asset/k1q/k1qmxhno3c",
    "archived_url": "http://web.archive.org/web/20260508114158/https://webtv.un.org/en/asset/k1q/k1qmxhno3c",
    "archived_at": "20260508114158",
    "status": "archived",